{
  "token_id": 10,
  "name": "GHOST//0010",
  "description": "GHOST//ROOT \u2014 one of 3,333 identities recovered from a distributed autonomous security network that disappeared without explanation.",
  "image": "pending://not-yet-rendered/collection/assets/test-batch/0010.png",
  "external_url": "https://ghostroot.site/identity/10/",
  "collection": {
    "name": "GHOST//ROOT",
    "symbol": "GHRT"
  },
  "attributes": [
    {
      "trait_type": "Entity",
      "value": "HOLLOW"
    },
    {
      "trait_type": "Access",
      "value": "USER"
    },
    {
      "trait_type": "Architecture",
      "value": "SEALED"
    },
    {
      "trait_type": "Face Material",
      "value": "PORCELAIN"
    },
    {
      "trait_type": "Eyes",
      "value": "FRACTURED"
    },
    {
      "trait_type": "Interface",
      "value": "SKELETAL INTERFACE"
    },
    {
      "trait_type": "Implant",
      "value": "SPINAL BUS"
    },
    {
      "trait_type": "Mantle",
      "value": "CERAMIC MANTLE"
    },
    {
      "trait_type": "Background",
      "value": "EVIDENCE VOID"
    },
    {
      "trait_type": "Signal",
      "value": "INTERMITTENT"
    },
    {
      "trait_type": "Origin Corruption",
      "value": "INTACT"
    },
    {
      "trait_type": "State",
      "value": "DORMANT"
    },
    {
      "trait_type": "Rarity Band",
      "value": "COMMON"
    }
  ]
}
