{
  "token_id": 4,
  "name": "GHOST//0004",
  "description": "GHOST//ROOT \u2014 one of 3,333 identities recovered from a distributed autonomous security network that disappeared without explanation.",
  "image": "pending://not-yet-rendered/collection/assets/test-batch/0004.png",
  "external_url": "https://ghostroot.site/identity/4/",
  "collection": {
    "name": "GHOST//ROOT",
    "symbol": "GHRT"
  },
  "attributes": [
    {
      "trait_type": "Entity",
      "value": "HUMAN"
    },
    {
      "trait_type": "Access",
      "value": "USER"
    },
    {
      "trait_type": "Architecture",
      "value": "SEALED"
    },
    {
      "trait_type": "Face Material",
      "value": "PORCELAIN"
    },
    {
      "trait_type": "Eyes",
      "value": "BIOMETRIC"
    },
    {
      "trait_type": "Interface",
      "value": "NULL MASK"
    },
    {
      "trait_type": "Implant",
      "value": "ANTENNA"
    },
    {
      "trait_type": "Mantle",
      "value": "ARCHIVE COAT"
    },
    {
      "trait_type": "Background",
      "value": "RACK SHADOW"
    },
    {
      "trait_type": "Signal",
      "value": "LOCKED"
    },
    {
      "trait_type": "Origin Corruption",
      "value": "INTACT"
    },
    {
      "trait_type": "State",
      "value": "DORMANT"
    },
    {
      "trait_type": "Rarity Band",
      "value": "COMMON"
    }
  ]
}
