{
  "token_id": 3,
  "name": "GHOST//0003",
  "description": "Permission revoked. By me. \u2014 GHOST//ROOT Genesis identity THE LAST ADMINISTRATOR. One of exactly three hand-authored 1/1 origin records. Origin: The last valid permission-revocation ledger reconstructed as a person",
  "image": "pending://not-yet-rendered/collection/assets/test-batch/0003.png",
  "external_url": "https://ghostroot.site/identity/3/",
  "collection": {
    "name": "GHOST//ROOT",
    "symbol": "GHRT"
  },
  "attributes": [
    {
      "trait_type": "Entity",
      "value": "SPECTER"
    },
    {
      "trait_type": "Access",
      "value": "ROOT"
    },
    {
      "trait_type": "Architecture",
      "value": "SINGULAR"
    },
    {
      "trait_type": "Face Material",
      "value": "RECONSTRUCTED"
    },
    {
      "trait_type": "Eyes",
      "value": "FRACTURED"
    },
    {
      "trait_type": "Interface",
      "value": "NEURAL VEIL"
    },
    {
      "trait_type": "Implant",
      "value": "SIGNAL CROWN"
    },
    {
      "trait_type": "Mantle",
      "value": "SPLIT SHELL"
    },
    {
      "trait_type": "Background",
      "value": "RELAY WELL"
    },
    {
      "trait_type": "Signal",
      "value": "CARRIER ECHO"
    },
    {
      "trait_type": "Origin Corruption",
      "value": "PACKET GHOSTING"
    },
    {
      "trait_type": "State",
      "value": "DORMANT"
    },
    {
      "trait_type": "Rarity Band",
      "value": "1/1"
    }
  ]
}
